OpenROAD v2.0-27463-gc3bd3a2184 
Features included (+) or not (-): +GPU +GUI +Python
This program is licensed under the BSD-3 license. See the LICENSE file for details.
Components of this program may be licensed under more restrictive licenses which must be honored.
[INFO ORD-0030] Using 4 thread(s).
read_liberty /home/rohit/OpenROAD-flow-scripts/flow/platforms/sky130hd/lib/sky130_fd_sc_hd__tt_025C_1v80.lib
read_db ./results/sky130hd/adder64/base/5_1_grt.odb
source /home/rohit/OpenROAD-flow-scripts/flow/platforms/sky130hd/setRC.tcl
[WARNING STA-0450] virtual clock clk can not be propagated.
detailed_route -output_drc ./reports/sky130hd/adder64/base/5_route_drc.rpt -output_maze ./results/sky130hd/adder64/base/maze.log -droute_end_iter 64 -verbose 1 -drc_report_iter_step 5
[INFO DRT-0149] Reading tech and libs.
[WARNING DRT-0349] LEF58_ENCLOSURE with no CUTCLASS is not supported. Skipping for layer mcon
[WARNING DRT-0349] LEF58_ENCLOSURE with no CUTCLASS is not supported. Skipping for layer mcon
[WARNING DRT-0349] LEF58_ENCLOSURE with no CUTCLASS is not supported. Skipping for layer via
[WARNING DRT-0349] LEF58_ENCLOSURE with no CUTCLASS is not supported. Skipping for layer via
[WARNING DRT-0349] LEF58_ENCLOSURE with no CUTCLASS is not supported. Skipping for layer via2
[WARNING DRT-0349] LEF58_ENCLOSURE with no CUTCLASS is not supported. Skipping for layer via2
[WARNING DRT-0349] LEF58_ENCLOSURE with no CUTCLASS is not supported. Skipping for layer via3
[WARNING DRT-0349] LEF58_ENCLOSURE with no CUTCLASS is not supported. Skipping for layer via3
[WARNING DRT-0349] LEF58_ENCLOSURE with no CUTCLASS is not supported. Skipping for layer via4
[WARNING DRT-0349] LEF58_ENCLOSURE with no CUTCLASS is not supported. Skipping for layer via4

Units:                1000
Number of layers:     13
Number of macros:     441
Number of vias:       29
Number of viarulegen: 25

[INFO DRT-0150] Reading design.

Design:                   adder64
Die area:                 ( 0 0 ) ( 545860 545860 )
Number of track patterns: 12
Number of DEF vias:       0
Number of components:     4288
Number of terminals:      196
Number of snets:          2
Number of nets:           517

[INFO DRT-0167] List of default vias:
  Layer via
    default via: M1M2_PR
  Layer via2
    default via: M2M3_PR
  Layer via3
    default via: M3M4_PR
  Layer via4
    default via: M4M5_PR
[INFO DRT-0162] Library cell analysis.
[INFO DRT-0163] Instance analysis.
[INFO DRT-0164] Number of unique instances = 11.
[INFO DRT-0168] Init region query.
[INFO DRT-0024]   Complete FR_MASTERSLICE.
[INFO DRT-0024]   Complete Fr_VIA.
[INFO DRT-0024]   Complete li1.
[INFO DRT-0024]   Complete mcon.
[INFO DRT-0024]   Complete met1.
[INFO DRT-0024]   Complete via.
[INFO DRT-0024]   Complete met2.
[INFO DRT-0024]   Complete via2.
[INFO DRT-0024]   Complete met3.
[INFO DRT-0024]   Complete via3.
[INFO DRT-0024]   Complete met4.
[INFO DRT-0024]   Complete via4.
[INFO DRT-0024]   Complete met5.
[INFO DRT-0033] FR_MASTERSLICE shape region query size = 0.
[INFO DRT-0033] FR_VIA shape region query size = 0.
[INFO DRT-0033] li1 shape region query size = 25228.
[INFO DRT-0033] mcon shape region query size = 13744.
[INFO DRT-0033] met1 shape region query size = 12656.
[INFO DRT-0033] via shape region query size = 19405.
[INFO DRT-0033] met2 shape region query size = 11726.
[INFO DRT-0033] via2 shape region query size = 15524.
[INFO DRT-0033] met3 shape region query size = 11754.
[INFO DRT-0033] via3 shape region query size = 15524.
[INFO DRT-0033] met4 shape region query size = 4681.
[INFO DRT-0033] via4 shape region query size = 761.
[INFO DRT-0033] met5 shape region query size = 839.
[INFO DRT-0165] Start pin access.
[INFO DRT-0078]   Complete 66 pins.
[INFO DRT-0081]   Complete 11 unique inst patterns.
[INFO DRT-0084]   Complete 260 groups.
#scanned instances     = 4288
#unique  instances     = 11
#stdCellGenAp          = 147
#stdCellValidPlanarAp  = 0
#stdCellValidViaAp     = 108
#stdCellPinNoAp        = 0
#stdCellPinCnt         = 1032
#instTermValidViaApCnt = 0
#macroGenAp            = 0
#macroValidPlanarAp    = 0
#macroValidViaAp       = 0
#macroNoAp             = 0
[INFO DRT-0166] Complete pin access.
[INFO DRT-0267] cpu time = 00:00:02, elapsed time = 00:00:00, memory = 193.72 (MB), peak = 193.72 (MB)

[INFO DRT-0157] Number of guides:     2505

[INFO DRT-0169] Post process guides.
[INFO DRT-0176] GCELLGRID X 0 DO 79 STEP 6900 ;
[INFO DRT-0177] GCELLGRID Y 0 DO 79 STEP 6900 ;
[INFO DRT-0028]   Complete FR_MASTERSLICE.
[INFO DRT-0028]   Complete Fr_VIA.
[INFO DRT-0028]   Complete li1.
[INFO DRT-0028]   Complete mcon.
[INFO DRT-0028]   Complete met1.
[INFO DRT-0028]   Complete via.
[INFO DRT-0028]   Complete met2.
[INFO DRT-0028]   Complete via2.
[INFO DRT-0028]   Complete met3.
[INFO DRT-0028]   Complete via3.
[INFO DRT-0028]   Complete met4.
[INFO DRT-0028]   Complete via4.
[INFO DRT-0028]   Complete met5.
[INFO DRT-0178] Init guide query.
[INFO DRT-0035]   Complete FR_MASTERSLICE (guide).
[INFO DRT-0035]   Complete Fr_VIA (guide).
[INFO DRT-0035]   Complete li1 (guide).
[INFO DRT-0035]   Complete mcon (guide).
[INFO DRT-0035]   Complete met1 (guide).
[INFO DRT-0035]   Complete via (guide).
[INFO DRT-0035]   Complete met2 (guide).
[INFO DRT-0035]   Complete via2 (guide).
[INFO DRT-0035]   Complete met3 (guide).
[INFO DRT-0035]   Complete via3 (guide).
[INFO DRT-0035]   Complete met4 (guide).
[INFO DRT-0035]   Complete via4 (guide).
[INFO DRT-0035]   Complete met5 (guide).
[INFO DRT-0036] FR_MASTERSLICE guide region query size = 0.
[INFO DRT-0036] FR_VIA guide region query size = 0.
[INFO DRT-0036] li1 guide region query size = 798.
[INFO DRT-0036] mcon guide region query size = 0.
[INFO DRT-0036] met1 guide region query size = 644.
[INFO DRT-0036] via guide region query size = 0.
[INFO DRT-0036] met2 guide region query size = 393.
[INFO DRT-0036] via2 guide region query size = 0.
[INFO DRT-0036] met3 guide region query size = 111.
[INFO DRT-0036] via3 guide region query size = 0.
[INFO DRT-0036] met4 guide region query size = 0.
[INFO DRT-0036] via4 guide region query size = 0.
[INFO DRT-0036] met5 guide region query size = 0.
[INFO DRT-0179] Init gr pin query.
[INFO DRT-0267] cpu time = 00:00:00, elapsed time = 00:00:00, memory = 194.47 (MB), peak = 194.47 (MB)
[INFO DRT-0245] skipped writing guide updates to database.
[INFO DRT-0185] Post process initialize RPin region query.
[INFO DRT-0181] Start track assignment.
[INFO DRT-0184] Done with 1191 vertical wires in 2 frboxes and 755 horizontal wires in 2 frboxes.
[INFO DRT-0186] Done with 83 vertical wires in 2 frboxes and 81 horizontal wires in 2 frboxes.
[INFO DRT-0182] Complete track assignment.
[INFO DRT-0267] cpu time = 00:00:00, elapsed time = 00:00:00, memory = 204.81 (MB), peak = 214.39 (MB)
[INFO DRT-0187] Start routing data preparation.
[INFO DRT-0267] cpu time = 00:00:00, elapsed time = 00:00:00, memory = 205.18 (MB), peak = 214.39 (MB)
[INFO DRT-0194] Start detail routing.
[INFO DRT-0195] Start 0th optimization iteration.
    Completing 10% with 0 violations.
    elapsed time = 00:00:00, memory = 229.80 (MB).
    Completing 20% with 0 violations.
    elapsed time = 00:00:00, memory = 244.69 (MB).
    Completing 30% with 3 violations.
    elapsed time = 00:00:00, memory = 240.83 (MB).
    Completing 40% with 3 violations.
    elapsed time = 00:00:00, memory = 253.70 (MB).
    Completing 50% with 3 violations.
    elapsed time = 00:00:00, memory = 253.70 (MB).
    Completing 60% with 4 violations.
    elapsed time = 00:00:00, memory = 254.33 (MB).
    Completing 70% with 4 violations.
    elapsed time = 00:00:00, memory = 254.33 (MB).
    Completing 80% with 18 violations.
    elapsed time = 00:00:00, memory = 254.33 (MB).
    Completing 90% with 18 violations.
    elapsed time = 00:00:00, memory = 256.33 (MB).
    Completing 100% with 21 violations.
    elapsed time = 00:00:00, memory = 256.33 (MB).
[INFO DRT-0199]   Number of violations = 22.
Viol/Layer        mcon   met1   met2
Cut Spacing          3      0      0
Metal Spacing        0      6      2
Recheck              0      0      1
Short                0     10      0
[INFO DRT-0267] cpu time = 00:00:01, elapsed time = 00:00:00, memory = 603.33 (MB), peak = 603.33 (MB)
Total wire length = 9270 um.
Total wire length on LAYER li1 = 0 um.
Total wire length on LAYER met1 = 2468 um.
Total wire length on LAYER met2 = 6014 um.
Total wire length on LAYER met3 = 788 um.
Total wire length on LAYER met4 = 0 um.
Total wire length on LAYER met5 = 0 um.
Total number of vias = 2074.
Up-via summary (total 2074):

-----------------------
 FR_MASTERSLICE       0
            li1    1046
           met1     917
           met2     111
           met3       0
           met4       0
-----------------------
               2074


[INFO DRT-0195] Start 1st optimization iteration.
    Completing 10% with 22 violations.
    elapsed time = 00:00:00, memory = 604.45 (MB).
    Completing 20% with 22 violations.
    elapsed time = 00:00:00, memory = 604.45 (MB).
    Completing 30% with 20 violations.
    elapsed time = 00:00:00, memory = 604.45 (MB).
    Completing 40% with 20 violations.
    elapsed time = 00:00:00, memory = 606.33 (MB).
    Completing 50% with 20 violations.
    elapsed time = 00:00:00, memory = 606.33 (MB).
    Completing 60% with 18 violations.
    elapsed time = 00:00:00, memory = 606.33 (MB).
    Completing 70% with 18 violations.
    elapsed time = 00:00:00, memory = 606.33 (MB).
    Completing 80% with 9 violations.
    elapsed time = 00:00:00, memory = 606.33 (MB).
    Completing 90% with 9 violations.
    elapsed time = 00:00:00, memory = 606.33 (MB).
    Completing 100% with 0 violations.
    elapsed time = 00:00:00, memory = 606.33 (MB).
[INFO DRT-0199]   Number of violations = 0.
[INFO DRT-0267] cpu time = 00:00:01, elapsed time = 00:00:00, memory = 606.45 (MB), peak = 606.45 (MB)
Total wire length = 9251 um.
Total wire length on LAYER li1 = 0 um.
Total wire length on LAYER met1 = 2431 um.
Total wire length on LAYER met2 = 6005 um.
Total wire length on LAYER met3 = 814 um.
Total wire length on LAYER met4 = 0 um.
Total wire length on LAYER met5 = 0 um.
Total number of vias = 2068.
Up-via summary (total 2068):

-----------------------
 FR_MASTERSLICE       0
            li1    1046
           met1     911
           met2     111
           met3       0
           met4       0
-----------------------
               2068


[INFO DRT-0198] Complete detail routing.
Total wire length = 9251 um.
Total wire length on LAYER li1 = 0 um.
Total wire length on LAYER met1 = 2431 um.
Total wire length on LAYER met2 = 6005 um.
Total wire length on LAYER met3 = 814 um.
Total wire length on LAYER met4 = 0 um.
Total wire length on LAYER met5 = 0 um.
Total number of vias = 2068.
Up-via summary (total 2068):

-----------------------
 FR_MASTERSLICE       0
            li1    1046
           met1     911
           met2     111
           met3       0
           met4       0
-----------------------
               2068


[INFO DRT-0267] cpu time = 00:00:03, elapsed time = 00:00:01, memory = 606.58 (MB), peak = 606.58 (MB)

[INFO DRT-0180] Post processing.
[INFO GRT-0012] Found 0 antenna violations.
[INFO ANT-0002] Found 0 net violations.
[INFO ANT-0001] Found 0 pin violations.
[INFO ANT-0002] Found 0 net violations.
[INFO ANT-0001] Found 0 pin violations.
write_db ./results/sky130hd/adder64/base/5_2_route.odb
Elapsed time: 0:02.73[h:]min:sec. CPU time: user 6.96 sys 0.26 (263%). Peak memory: 621136KB.
Log                        Elapsed/s Peak Memory/MB  sha1sum .odb [0:20)
5_2_route                          2            606 3319463ec6634d10c9c0
